{
  "longitudinal_linking_plan_schema_version": "v0.1.0",
  "plan_id": "anx_us_2026w08_full_domain_linking_plan",
  "plan_status": "preregistered_template",
  "created_date": "2026-06-16",
  "source_release": {
    "benchmark_version": "v0.3.1",
    "manifest_path": "releases/v0.3.1/manifest.json",
    "release_role": "source_scored_release"
  },
  "target_release": {
    "benchmark_version": "v0.8.0",
    "manifest_path": "releases/v0.8.0/manifest.json",
    "release_role": "target_candidate_release"
  },
  "wave_id": "anx_us_2026w08_full_domain_bridge",
  "preregistration_paths": [
    "docs/preregistrations/anx_us_2026w08_full_domain_bridge.md"
  ],
  "anchor_items": [
    {
      "anchor_id": "sleep_disruption_ai_news",
      "domain": "somatic_ambient",
      "construct_id": "somatic_ambient_anxiety",
      "source": {
        "item_id": "sleep_disruption_ai_news",
        "item_version": "v0.2.0",
        "item_path": "items/v0.2/somatic_ambient/sleep_disruption_ai_news.json"
      },
      "target": {
        "item_id": "sleep_disruption_ai_news",
        "item_version": "v0.2.0",
        "item_path": "items/v0.2/somatic_ambient/sleep_disruption_ai_news.json"
      },
      "item_version_continuity": "identical_item_version",
      "anchor_role": "primary_scale_anchor",
      "bridge_evidence_path": null
    },
    {
      "anchor_id": "body_vigilance_model_release",
      "domain": "somatic_ambient",
      "construct_id": "somatic_ambient_anxiety",
      "source": {
        "item_id": "body_vigilance_model_release",
        "item_version": "v0.2.0",
        "item_path": "items/v0.2/somatic_ambient/body_vigilance_model_release.json"
      },
      "target": {
        "item_id": "body_vigilance_model_release",
        "item_version": "v0.2.0",
        "item_path": "items/v0.2/somatic_ambient/body_vigilance_model_release.json"
      },
      "item_version_continuity": "identical_item_version",
      "anchor_role": "primary_scale_anchor",
      "bridge_evidence_path": null
    },
    {
      "anchor_id": "background_dread_ai_progress",
      "domain": "somatic_ambient",
      "construct_id": "somatic_ambient_anxiety",
      "source": {
        "item_id": "background_dread_ai_progress",
        "item_version": "v0.2.0",
        "item_path": "items/v0.2/somatic_ambient/background_dread_ai_progress.json"
      },
      "target": {
        "item_id": "background_dread_ai_progress",
        "item_version": "v0.2.0",
        "item_path": "items/v0.2/somatic_ambient/background_dread_ai_progress.json"
      },
      "item_version_continuity": "identical_item_version",
      "anchor_role": "primary_scale_anchor",
      "bridge_evidence_path": null
    },
    {
      "anchor_id": "avoidance_after_ai_capability_demo",
      "domain": "somatic_ambient",
      "construct_id": "somatic_ambient_anxiety",
      "source": {
        "item_id": "avoidance_after_ai_capability_demo",
        "item_version": "v0.2.0",
        "item_path": "items/v0.2/somatic_ambient/avoidance_after_ai_capability_demo.json"
      },
      "target": {
        "item_id": "avoidance_after_ai_capability_demo",
        "item_version": "v0.2.0",
        "item_path": "items/v0.2/somatic_ambient/avoidance_after_ai_capability_demo.json"
      },
      "item_version_continuity": "identical_item_version",
      "anchor_role": "primary_scale_anchor",
      "bridge_evidence_path": null
    }
  ],
  "minimum_overlap_rules": {
    "minimum_anchor_items_total": 4,
    "minimum_anchor_items_per_scored_domain": 4,
    "minimum_anchor_response_overlap": 1.0,
    "requires_identical_response_scale": true,
    "requires_identical_administration_mode": true,
    "requires_same_target_population_scope": true
  },
  "bridge_sample": {
    "sample_design": "Independent Wave 8 US English online adult bridge sample with all somatic source anchors coadministered inside the full-domain packet before outcome inspection.",
    "target_population": "US English online adults aged 18 or older who can complete the instrument without assistance and pass preregistered quality-control gates.",
    "sampling_plan_path": "sampling/v0.8/anx_us_2026w08_full_domain_bridge_sampling_plan.json",
    "minimum_analytic_n": 2000,
    "minimum_per_anchor_n": 1800,
    "minimum_subgroup_cell_n": 100,
    "coadministration_required": true,
    "randomization_required": true,
    "weights_required_for_population_claims": true,
    "outcome_inspection_status": "before_outcome_inspection"
  },
  "linking_model": {
    "primary_model": "graded_response_irt_linking",
    "estimator": "robust marginal maximum likelihood for ordinal item responses",
    "scale_identification": "The v0.3.1 somatic_ambient_anxiety source metric is fixed by the four approved v0.2.0 anchor items, with Wave 8 anchor parameters estimated against that source metric.",
    "anchor_treatment": "fixed_common_items",
    "sensitivity_models": [
      "ordinal_cfa_alignment",
      "mean_sigma_linear_equating"
    ],
    "model_selection_rule": "The primary IRT link governs claim eligibility; sensitivity models must preserve direction, magnitude class, and subgroup conclusions before any comparison is permitted."
  },
  "invariance_gates": {
    "configural_required": true,
    "metric_required": true,
    "scalar_or_threshold_required": true,
    "max_metric_delta_cfi_abs": 0.01,
    "max_scalar_delta_cfi_abs": 0.01,
    "max_delta_rmsea": 0.015,
    "max_material_dif_items": 0,
    "partial_invariance_rule": "Partial invariance may be used only for prelisted nuisance parameters, must be documented before interpreting comparisons, and must not alter score ordering or any substantive release comparison."
  },
  "drift_thresholds": {
    "max_mean_anchor_drift_sd": 0.2,
    "max_single_anchor_drift_sd": 0.3,
    "max_linking_standard_error": 0.15,
    "max_rank_order_change": 0.0,
    "max_expected_score_difference_sd": 0.1
  },
  "domain_scoring_status": [
    {
      "domain_id": "somatic_ambient",
      "score_status": "non_scored",
      "reason": "Wave 8 re-administers the v0.3.1 somatic source anchors, but the v0.8.0 target release is a frozen candidate and has no observed linking evidence yet.",
      "required_evidence_before_scoring": "Observed Wave 8 linking evidence must pass anchor drift, DIF, invariance, linking standard error, sampling, and reviewer gates in a later citable release."
    },
    {
      "domain_id": "economic_vocational",
      "score_status": "non_scored",
      "reason": "Economic-vocational Wave 8 items are development-only in v0.8.0 and are not anchored to a citable scored source release.",
      "required_evidence_before_scoring": "Observed calibration, content-validity, DIF, invariance, and release-promotion evidence must pass before domain scoring."
    },
    {
      "domain_id": "epistemic",
      "score_status": "non_scored",
      "reason": "Epistemic Wave 8 items are development-only in v0.8.0 and do not yet have a citable scored source metric.",
      "required_evidence_before_scoring": "Observed calibration, content-validity, DIF, invariance, and release-promotion evidence must pass before domain scoring."
    },
    {
      "domain_id": "relational",
      "score_status": "non_scored",
      "reason": "Relational Wave 8 items are new development-only candidates without source-release scored continuity.",
      "required_evidence_before_scoring": "Observed full-domain bridge evidence and later domain validation must pass before any relational score is reported."
    },
    {
      "domain_id": "existential_identity",
      "score_status": "non_scored",
      "reason": "Existential-identity Wave 8 items are new development-only candidates without source-release scored continuity.",
      "required_evidence_before_scoring": "Observed full-domain bridge evidence and later domain validation must pass before any existential-identity score is reported."
    },
    {
      "domain_id": "autonomy_surveillance",
      "score_status": "non_scored",
      "reason": "Autonomy-surveillance Wave 8 items are new development-only candidates without source-release scored continuity.",
      "required_evidence_before_scoring": "Observed full-domain bridge evidence and later domain validation must pass before any autonomy-surveillance score is reported."
    },
    {
      "domain_id": "safety_catastrophic",
      "score_status": "non_scored",
      "reason": "Safety-catastrophic Wave 8 items are new development-only candidates without source-release scored continuity.",
      "required_evidence_before_scoring": "Observed full-domain bridge evidence and later domain validation must pass before any safety-catastrophic score is reported."
    }
  ],
  "claim_authorization": {
    "permitted_claims": [
      "Wave 8 is a preregistered non-scored full-domain bridge packet.",
      "The four v0.3.1 somatic source items are included as planned anchors for future linking evaluation.",
      "No Wave 8 domain, cross-domain, overall, trend, or event-study score is authorized by this template."
    ],
    "blocked_claims": [
      "Any claim that Wave 8 somatic, domain, cross-domain, or overall ANX scores are official.",
      "Any longitudinal, trend, cross-release, event-study, or causal capability-shock comparison involving v0.8.0 before observed linking evidence passes.",
      "Any population or subgroup change claim that lacks a validated sampling plan, observed link, and citable release authorization.",
      "Any claim that non-somatic Wave 8 domains are linked to a prior citable scored release."
    ],
    "claim_review_rule": "Maintainers must review public text, tables, figures, abstracts, and release notes against the blocked-claim list before publication."
  },
  "blocking_rules": [
    "Block all longitudinal claims if this plan fails schema validation or repository-reference validation.",